<?xml version="1.0" encoding="UTF-8"?>
<?xml-stylesheet type="text/xsl" href="history.xsl"?>
<!DOCTYPE document SYSTEM "document.dtd">

<document header="更新履歴(2007年)">

<release version="1.8.5-beta070114" date="2007/01/14(日)">
生のdatファイルに\0などの制御文字が含まれていると表示が壊れるバグを修正
スレ一覧のマークでのソーティングアルゴリズムを変更
キャッシュのログ検索を暫定的に実装
ツールバーにサイドバーの切り替えボタンを付けた
移転処理した時に移転した板を表示するダイアログでTextViewを使用した
移転処理をしたときにSETTING.TXTをロードしなくなる時があるバグを修正
移転したときに履歴メニューのURLが変更されていなかったバグを修正
外部板ビューを廃止して外部板は板一覧の先頭に表示するようにした
板一覧とお気に入りをサイドバー形式に変更
スレ一覧、スレ表示、画像タブを廃止
ビュー切り替えボタンをツールバーに追加
ツールバーの位置を切り替えられるようにした
書き込み時のデフォルトの名前とメールアドレスを板別に設定できるようにした
書き込みビューにundoボタンを付けた
画像ビューでキーボードでスクロール出来るようにした
チルトボタンの設定を button.conf に追加
</release>

<release version="1.8.5-rc070121" date="2007/01/21(日)">
書き込みビューでCtrl+n,pでカーソルを移動した時にスクロールしないバグを修正
書き込みプレビューで画像をダウンロードしてもリンクの色が変わらないバグを修正
書き込みプレビューで画像を削除してもリンクの色が変わらないバグを修正
設定メニューに「書き込みビューでEmacs風のキーバインドにする」の項目を追加
2.4以下のgtkmmでスピンボックスの値が変わらなかったバグを修正
板一覧とお気に入りをコンボボックスで切り替えられるようにした
ツリービューの背景色設定にgtkrcを用いる設定を追加( use_tree_gtkrc )
画像ビューを開かないようにする設定を追加( use_image_view )
選択不可のユーザコマンドを非表示にする設定追加( hide_usrcmd )
指定した数( max_show_usrcmd )以上の時はサブメニュー表示にする設定追加
</release>

<release version="1.8.5-070203" date="2007/02/03(土)">
参照文字に&amp;yen;追加
スレ一覧を全部閉じてから板一覧を閉じてもスレにフォーカスが移らないバグを修正
初回起動時に板一覧ではなくてお気に入りにフォーカスがあるバグを修正
ビューの切り替え方法を説明したダイアログを表示するようにした
移転情報テーブルが循環しているとお気に入りのアドレスが空白になるバグを修正
</release>

<release version="1.8.8-beta070218" date="2007/02/18(日)">
表示されていないビューの切り替えボタンやメニューは非アクティブにした
「選択範囲を引用してレス」を右クリックメニューに追加
2pane, 3paneモードの切り替えなどを再起動無しでできるようにした
ツールバーの位置を再起動無しで切り替えられるようにした
複数のスレを表示しているときにウィンドウのリサイズを高速化
3pane表示のときに開いていないビューを隠すようにした
埋め込み書き込みビュー実装
画像ウィンドウ分離表示機能実装
板移転時にメッセージのjavascriptを解析して移転情報を更新する機能を実装
ユーザコマンドに$DATURLと$LOCALDATを追加
http://info.2ch.net を板として認識していたバグを修正
idpopup_by_mo, refpopup_by_mo,namepopup_by_mo 設定追加
名前欄のbタグで囲まれたトリップなどの文字列に色を付けられるようにした( thank to tamagodake氏)
</release>

<release version="1.8.8-beta070317" date="2007/03/17(土)">
ヘルプファイルをXML化した( thank to tamagodake氏)
フォント、色詳細設定ダイアログ追加( thank to tamagodake氏)
スレ一覧の速度の計算アルゴリズムを変えた
Debian GNU/kFreeBSD に configure.inを対応した
ダイアログボックスのフォーカス処理をきちんとするようにした
書き込みビューを開いているときにスレビューの「レス」「参照してレス」、および「引用してレス」
を選択すると書き込みビューに引用できるようにした( thank to tamagodake氏)
書き込みビューに「書き込み後に閉じない」ボタン追加
メニュー項目の見直しと整理
utf8環境で起動していないときは警告を出すようにした( thank to tamagodake氏)
メニューバーの表示設定追加(F8)
スレビューでのホイールスクロール速度設定追加( jd.confのscroll_size )
RFC規定外の文字(^など)もURL判定に用いる設定追加( jd.confのloose_url)
ロックファイルにPIDを保存して起動済み判定を厳密にした
書き込みビューのタブを取り除いてプレビューボタンを追加した
ローダ実行中にあるタイミングで別のローダを起動すると落ちるバグを修正( class Dispatchable 追加 )
ツリービューの行間スペース設定追加( jd.confのtree_ypad )
書き込み先がスレビューで開いているスレと異なるときは警告を出すようにした
ツリービューのハイライト色の設定追加
make時にx86_64で警告が出る問題を修正( thanks to 180氏)
ipv6使用オプション追加( jd.confのuse_ipv6)
書き込みビューにファイル挿入ボタン追加
</release>

<release version="1.8.8-beta070324" date="2007/03/24(土)">
画像ウィンドウ表示時に画像の参照元レスを開いてもウィンドウが閉じないバグを修正
画像ウィンドウ表示時にマウスジェスチャが表示されないバグを修正
画像ウインドウが表示される前にqを連打してウィンドウを閉じると落ちるバグを修正
KDE環境で画像ウィンドウ上でダイアログを閉じるとフォーカスが外れるバグを修正
GIF画像の読み込みに失敗すると落ちるバグを修正
強制画像再読み込みをしてもアイコン表示が変わらないバグを修正
埋め込み書き込みビューがフォーカスされてもURLとタイトルが変わらないバグを修正
埋め込み書き込みビューを開いたまま再起動するとフォーカスが外れるバグを修正
スレ一覧の読み込み中にスレを読んでいると読み込み終了時にスレ一覧に戻るバグを修正
スレビューにフォーカスがあるときはスレビューをクリックしても再描画をかけないようにした
AAポップアップメニューにAAが表示されないときがあるバグを修正
セットアップウィザード追加
初起動直後の初期フォントをシステムで利用可能な物から選ぶようにした
</release>

<release version="1.8.8-rc070330" date="2007/03/30(金)">
移転処理時にスレビューに対象板内のスレを開いていると再読み込み出来なくなるバグを修正
書き込みプレビュー画面でCtrl+g(検索)を押すと落ちるバグを修正
フォントの詳細設定ダイアログに行高さ調整の項目追加
フォントの詳細設定ダイアログに下線位置調整の項目追加
書き込みエディタの文字や背景色を変更できるようにした
スレビューでShift+キーにスクロール機能を割り当てると2回スクロールするバグを修正
細かいバグの修正
その他微調整
</release>

<release version="1.8.8-070403" date="2007/04/03(火)">
スレタイトルに特殊文字が入っているときにデコードされてなかったバグを応急処置で修正
</release>

<release version="1.9.5-beta070516" date="2007/05/16(水)">
スレビューの描画エンジンを最適化
新着しおり(ここまで読んだ)をブロック要素化
css対応( jd.css )
画像表示関係を高速化
レススキン対応( Res.html )
インライン画像実装
インライン画像のon/off設定をメニューに追加
お気に入りが空のとき最後に移動すると異常終了するバグを修正
板レベルのあぼーん設定を追加
画像キャッシュクリアを高速化
画像キャッシュ削除中にダイアログを出してキャンセル可能にした
画像プロパティにサイズやキャッシュ保護のチェックなどを追加
スレッドのデフォルトスタックサイズを減らした
画像あぼーん実装
履歴右クリックでポップアップ表示して特定の履歴を削除出来るようにした
Res.htmlにNAMELINKを追加(「名前」に置換する)
IDあぼーんしたら板の方にも自動で登録するようにした
タブ右クリックメニューの複数のタブを閉じる機能をまとめた
スレ一覧とスレビューのツールバー表示/非表示設定追加
板一覧とスレ一覧のテキストカラー変更設定追加
板一覧とスレ一覧の偶数行の色設定追加
画像ポップアップのマージン設定追加( jd.css の .imgpopup の margin )
サイドバーの表示切り替えの挙動がおかしかった問題を修正
bbsmenu.htmlの解釈がおかしかった問題を修正
スレのプロバティの番号あぼーんでマイナスの数を入れると落ちるバグを修正
スレのプロバティの番号あぼーんで12-34のような書式に対応した
</release>

<release version="1.9.5-beta070528" date="2007/05/28(月)">
右ペーンが空の時にサイドバーを最大化する設定(expand_sidebar)追加
ポップアップと画像カーソルの間のマージン設定(margin_imgpopup)追加
スレビューの削除メニューなどに「削除して再読み込み」を追加
スレを再読み込みして再起動するとスレ一覧の新着がマイナスになる問題を修正
水平タブ(0x09)が文字化けする問題を修正
スレビューで上下キーのスクロール速度を調整可能にした( key_scroll_size )
スレ内で検索をしたときにヒット数を表示するようにした
configureのオプションに--with-migemodictを追加
検索用補完Entryクラス実装
最近閉じたスレの履歴を実装
設定にプライバシーメニュー追加
</release>

<release version="1.9.5-beta070611" date="2007/06/11(月)">
XML処理の変更に伴い、*.xmlファイルの書式をXMLの仕様に従うように変更
BackspEditコントロール設定を追加
書き込みビューに最終書き込み日を表示
連続書き込み規制(書き込みビューに再書き込み可能になるまでの時間を表示)
スレビューで再読込ボタンで全タブを更新する機能追加( reload_allthreads )
JD ホームページのアドレスを設定できようにした( url_jdhp )
画像の横幅や縦幅が長い場合に落ちるバグを修正
画像のファイルサイズが0byteの時に画像ビューが落ちるバグを修正
AAメニューの履歴数を変更できるようにした( aahistory_size )
</release>

<release version="1.9.5-beta070616" date="2007/06/16(土)">
bbsmenu.html内にあるリンクは全て板とみなす設定追加( use_link_as_board )
アニメーションGIFの表示処理を軽減化
</release>

<release version="1.9.5-rc070625" date="2007/06/25(月)">
メール指定が無いときの名前欄の文字色を選択できるようにした
画像まわりの細かいバグをまとめて修正した
</release>

<release version="1.9.5-070630" date="2007/06/30(土)">
AAメニューでカーソル上下で誤動作するバグを修正
</release>

<release version="1.9.6-beta070804" date="2007/08/04(土)">
更新チェック機能実装
更新チェックのタイムアウト値の設定追加(loader_timeout_checkupdate)
スレが壊れているときにラベルの色を赤くするようにした
スレ一覧のポップアップが表示されないときがあるバグを修正
お気に入りでディレクトリ以外の行でも左キーで開いているフォルダを畳めるようにした
migemo検索の高速化パッチを適用
スレ一覧でインクリメンタル検索が出来るようにした ( inc_search_board = 1 )
メニュー項目でダイアログを開く行に「...」を付けるパッチを当てた
板を開いたまま再起動時するとSETTING.TXTを勝手にロードするバグを修正
SETTING.TXTの取得時に更新時刻を送るようにした
板のプロパティにローカルルールを表示
画像ビュアーで302の画像もダウンロードするようにした
画像のボタン設定追加(CloseImageButton,ScrollImageButton,CancelMosaicButton)
画像の拡張子と実際の形式が違うときはモザイク解除の時に警告するようにした
</release>

<release version="1.9.6-beta070918" date="2007/09/18(火)">
スレ一覧の表示項目を設定できるようにした
非アクティブのときに書き込みウィンドウを折り畳むようにした
GNOME環境でウィンドウを閉じたときに最大化が時々勝手に解除されるバグを修正
各ビューで全て選択(Ctrl+a)実装
書き込みビューのコンテキストメニューにAA入力の項目を追加
書き込みビューを閉じるときに編集中の文章を保存できるようにした
画像あぼーんの情報を削除できるようにした
画像ウィンドウでお気に入り追加ダイアログを開くとウィンドウが畳まれるバグを修正
アンカーのコンテキストメニューでジャンプが動作しなくなっていたバグを修正
全お気に入り更新チェックを追加
メインメニューに「ツール」の項目を追加
履歴メニューの項目もEnterキーを押してアクティブに出来るようにした
aboutダイアログ追加( パッチスレ71 )
button.confでDbl*の設定が効かなかったバグを修正
スレ一覧のログ検索ボタンを削除してツールメニューにログ検索移動
発言数のチェックを外すオプション追加( check_id = 1 )
スレをお気に入りに登録したときに自動でブックマーク設定するようにした
レス参照で色を変える回数を設定できるようにした( num_reference_high=3, num_reference_low=1 )
発言数で色を変える回数を変更できるようにした( num_id_high=4, num_id_low=2 )
画像のピクセル数が大きいときは警告するようにした( max_img_pixel = 20 )
タブのロック機能を実装
メインメニューからJDホームページの項目を削除(aboutダイアログから可能)
書き込みビューのコンテキストメニューに「クリップボードから引用」の項目を追加
書き込みビューのコンテキストメニューに「JDの動作環境を記入」の項目を追加
バージョン表示でSVN版のリビジョン番号を表示できるようにした
スレの再取得をするときにあぼーんなどのスレ情報を削除しないようにした
スレがDAT落ちしているときにラベルの色を青くするようにした
設定メニューに板、スレ、画像プロパティ項目追加
タブメニューに「プロパティ」追加
表示設定からタブの非表示が出来るようにした
</release>

<release version="1.9.6-rc070930" date="2007/09/30(日)">
お気に入りで新規ディレクトリの追加が出来なかったバグを修正
板一覧とお気に入りで前検索すると固まることがあるバグを修正
</release>

<release version="1.9.6-071005" date="2007/10/05(金)">
書き込みメッセージを保存した際にダイアログが再び出てしまうバグを修正
ログ検索中にビューを閉じても検索スレッドが停止しないバグを修正
</release>

<release version="1.9.7-beta071101" date="2007/11/01(木)">
BMP画像表示に対応
スレタイ検索機能実装( menu_search_title, url_search_title, regex_search_title )
BEログイン実装
BEのマーク表示をするようにした
メインツールバーと各ビューのツールバーの項目を編集出来るようにした
起動、シャットダウンを高速化した
板一覧を開くときにリダイレクトされたら移転のチェックをするようにした
メインメニューにキーアクセラレータとショートカットを追加
「JDの動作環境」の一部に「/etc/issue.net」値を取得して表示するようにした
書き込みプレビューでURLに含まれる「&amp;」が「&amp;amp;」と表示されてしまう問題を修正
「IPv6使用」設定をメニューに追加
</release>

<release version="1.9.7-beta071109" date="2007/11/09(金)">
「画像ポップアップを表示する」設定を追加
スレビューでリロード後に末尾に飛ぶ設定を追加( jump_after_reload )
スレビューの検索に「WEB検索」を追加( menu_search_web, url_search_web )
画像ビューを開いたまま閉じて再起動するとビューが展開されずに落ちるバグを修正
起動中やスレ表示前にスレビューの上をマウス移動すると落ちるバグを修正
ツールバー(リスト)項目設定のダイアログを充実させた
画像関係の表示メニューを設定メニューから表示メニューに移した
</release>

<release version="1.9.7-rc071115" date="2007/11/15(木)">
画像ビューのメニュー項目の一部にマウスジェスチャが表示されていなかったバグを修正
板一覧にフォーカスがあるときに板一覧再読み込みするとサイドバーが閉じるバグを修正
起動時にjd.confが読み込めない時はjd.confが存在するか確認するようにした
スレビューで他スレをポップアップ表示したあとキャッシュ削除してもポップアップ表示されるバグを修正
「画像を全て保存」でモザイクを外していない画像まで保存していた問題を修正
お気に入りで ディレクトリを削除するとキーボードフォーカスが外れるバグを修正
</release>

<release version="1.9.7-071122" date="2007/11/22(木)">
configureに --with-athlon64 オプションを追加
$LANGが取得出来なかった場合に落ちるバグを修正
SVN版で作業コピーでない場合にコンパイル出来なくなっていたバグを修正
</release>

<release version="1.9.8-beta071210" date="2007/12/10(月)">
RH系のブラウザをhtmlviewからxdg-openに変更した
メッセージダイアログでtabでラベルにフォーカスが移るバグを修正
リロード後に新着に自動的に移動する設定追加( jump_new_after_reload )
key.confに Scroll*Board と Scroll*Image を追加
起動時に画像ウィンドウも復元するとスレビューが表示されなかったバグを修正
スレビューでn,pで前後のレスに移動できるようにした
書き込みビューのファイル選択画面でキャンセルを押すとビューが閉じるバグを修正
ログ検索中に他の検索ビューを閉じると検索が終了するバグを修正
タブを中クリックで閉じる動作をキャンセルできるようにした
ポップアップフレームとオートスクロールマーカの色を設定できるようにした
お気に入りの最終行がディレクトリの時に最終行へのジャンプが正常に動作しないバグを修正
リンクの上でコンテキストメニューを開いてからマウスを移動してクリックするとリンクが開くバグを修正
デフォルトではOpenSSLではなくてGNUTLSを使用するようにした( --with-openssl でOpenSSL使用 )
テーマを変更したときにスレビューのラベルの背景色が変わらなかったバグを修正
</release>

<release version="1.9.8-beta071218" date="2007/12/18(火)">
テーマによってはLabelEntryの背景色が変になるバグを修正
dat落ちしたスレを開いたとき、タブに「???」と表示するようにした
ウィンドウのリサイズ直後にスレの範囲選択の位置がズレる時があったバグを修正
レスにUTF-8直書きされているときにスレが壊れていると判定されるバグを修正
スレの連鎖あぼーん設定のチェックが再起動すると外れるバグを修正
テーマによってはタブの色が変になるバグを修正
</release>

<release version="1.9.8-rc071223" date="2007/12/23(日)">
テーマによってはLabelの背景色が変になるバグを修正
バージョン2.4のgtkmmでビルド出来なかった問題を修正
旧設定ファイル(.jdrc)が存在するとキャッシュディレクトリが出来ない時があるバグを修正
</release>

<release version="1.9.8-071228" date="2007/12/28(金)">
お気に入りでアイテムが消えない時があったバグを修正
</release>

</document>
