<?xml version="1.0" encoding="UTF-8"?>
<?xml-stylesheet type="text/xsl" href="history.xsl"?>
<!DOCTYPE document SYSTEM "document.dtd">

<document header="更新履歴(2009年)">

<release version="2.1.1-beta090128" date="2009/1/28(水)">
お気に入りの編集に対するUNDOとREDOを実装した
お気に入り編集ウィンドウに検索窓を付けた
書き込みしたレスに&quot;が含まれていると鉛筆マークが付かないバグを修正
p2経由で書き込みをチェックしてもbbspink.comではブラウザが開かないバグを修正
</release>

<release version="2.2.0-090212" date="2009/2/12(木)">
キャッシュのsubject.txtが古いと次スレのリンクをクリックした時にdat落ちになるバグを修正
キャッシュのsubject.txtが無いと次スレのリンクをクリックした時にloading表示が消えないバグを修正
キャッシュのsubject.txtが無い時に次スレのリンクをクリックした時のスレタイ類似度計算に
レーベンシュタイン距離を使うようにした
次スレ移行時にお気に入りの名前が編集されているときは新スレの名前にしないようにした
書き込み時にWAVE DASH 問題のため書き込みマークが付かない問題を修正
「スレ情報を消さずにスレ再取得」でタブのロックが外れるバグを修正
「スレ情報を消さずにスレ再取得」でタブの位置がズレるバグを修正
</release>

<release version="2.3.0-090305" date="2009/3/05(木)">
したらばに書き込めなくなった問題に対応( application/x-www-form-urlencoded )
まちBBSの仕様変更に対応 ( read.pl -> read.cgi )
スレタイの先頭がスペースで始まっている場合にスレ一覧で先頭のスペースが省略表示されるバグを修正
タブが含まれる書き込みで鉛筆マークが付かないバグを修正
gtkrcでnotebookのythicknessを0にしてスレ一覧を開くとCPUが100%になるバグを修正
他のビューにタブをドロップするとタブ移動の矢印が消えなかったバグを修正
画像ダウンロード中のツールチップの文字色をスレビューの文字色と合わせた
サイドバーに「お気に入り更新チェックしてタブで開く」ボタンを追加出きるようにした
web検索のショートカットキーを追加 (Ctrl+k)
スレタイ検索のショートカットキーを追加( Ctrl+t)
ローカルログ検索のショートカットキーを追加( Ctrl+Enter )
全ログ検索のショートカットキーを設定出きるようにした( デフォルト無効 )
about:configに「Ctrl+qでウィンドウを閉じない」を追加
</release>

<release version="2.4.0-beta090429" date="2009/4/29(水)">
スレのプロパティのあぼーん設定に「sage以外あぼーん」を追加
まちBBSのサブジェクトをtitleタグから取得するようにした( offlawモードでない時 )
まちBBSのofflaw.cgi読み込みモードを実装( 設定メニューの一般項目で設定)
動作環境のconfigureオプションとして表示する内容を一部に限定した
p2にログインして直接書き込みできるようにした
鬼車使用時に改行が入ると正規表現のマッチングに失敗する問題を修正
about:configに画像のスムージングレベルの設定を追加
datファイルのインポート機能を実装
datファイルの一時表示機能を実装
JBBSの文字コードをEUC-JPからEUCJP-WINに変更(丸付き数字の文字化け対策)
次スレ移行時に古いスレタイが新スレタイに変わらない時があるバグを修正
16進数の文字参照を実装
スレ一覧更新時にDat落ちしたスレをスレッドあぼーんのリストから取り除ける様にした(ダイアログ表示)
まちBBSのトップページをWebブラウザで開く事が出来ない問題を修正
フォント幅の計算時にメモリの割り当て領域外にアクセスする場合があったバグを修正
板(スレ一覧)の更新チェック機能を実装
タブ切り替えボタンをタブの右側に追加
</release>

<release version="2.4.0-beta090510" date="2009/5/10(日)">
gtk+-2.4辺りのバージョンのgtkを使用するとスレビューのツールバーのボタンが押せないバグを修正
ハッシュの導入によるDBTREE::BoardBase::get_article関数の高速化
configureオプションに「--with-native」を追加(gcc>=4.2, x86 or x86_64)
スレビューの描画領域の高さが1以下の時にスレの読み込みをすると落ちるバグを修正
-s ( --skip-setup ) 起動オプション追加
</release>

<release version="2.4.0-rc090516" date="2009/5/16(土)">
スレにフォントに含まれない文字がある時にコンソールに大量のエラーが表示される問題を修正
Dat落ちしたスレの更新可能アイコン表示が消えないバグを修正
3ペーン表示時にタブをクリックしてもスレ一覧とスレビュー間のフォーカスが移らないバグを修正
3ペーン表示時にタブ上でホイールを回転してもスレ一覧とスレビュー間のフォーカスが移らないバグを修正
タブ切り替えボタンでタブを切り替えたときにスレタイやステータスが変わらないバグを修正
タブメニューの移動サブメニューでタブを切り替えたときにスレタイやステータスが変わらないバグを修正
</release>

<release version="2.4.0-090522" date="2009/5/22(金)">
細かいバグをいくつか修正
</release>

<release version="2.4.1-beta090628" date="2009/6/28(日)">
水平線(HR)の左端をテキストの字下げ位置に合わせた
スレ一覧でキャッシュが無いスレは「dat保存」メニューを選択できないようにした
datファイルのサイズ表記を k から K に変更
画像メニューに「エラー画像を閉じる」を追加(パッチ124)
jd.confの設定値が異常な場合の安全策を追加
現在表示中のタブの表示が変(右端が切れる時がある)な問題を修正
タブ上でのホイール回転でタブを循環表示するようにした
タブ切り替えボタンの枠がフォーカス時にはみ出るバグを修正
ローダの仕様を変更(詳しくはJDスレ7-613参照)
表示位置でタブを選択出来るキーバインドを追加
win32対応
スレビューの画像ポップアップメニューに「モザイクで開く」を追加
書き込みプレビューで新方式のトリップに対応
画像ポップアップ表示時にポインタがポップアップと重なるとポップアップが消えるバグを修正
</release>

<release version="2.4.1-090712" date="2009/7/12(日)">
タブ切り替えメニューにタブのアイコンを表示
お気に入りの次スレ自動更新時に確認ダイアログを表示するようにした
表示メニュー→詳細→一般に「ツールバーの背景を描画する」を追加
</release>

<release version="2.4.2-beta090806" date="2009/08/06(木)">
板一覧の更新時にエラー等で新規データが空になった場合でも更新されてしまう問題を修正
サイドバーのアイコン表示切り替えアルゴリズムを効率化
サイドバーの項目をクリックしてもアイコン表示が戻らない時があったバグを修正
サイドバーの更新チェックのキャンセルが効かなかったバグを修正
サイドバーに履歴ビューを実装
サイドバーの更新チェック機能を改良
履歴メニューを改良
スレ一覧の!のソートモードにモード3を追加
スレビューのコンテキストメニューの項目を編集できるようにした
スレビューのコンテキストメニューに「再読み込み」を追加
スレビューのコンテキストメニューに「タイトルとURLをコピー」を追加
スレビューのコンテキストメニューに「お気に入りに追加」を追加
ツールバー項目設定の「元に戻す」ボタンを押してもデフォルト状態に戻らない問題を修正
レスポップアップで行数の少ないレスでもスクロールさせないと全文が読めないバグを修正
</release>

<release version="2.4.2-beta090914" date="2009/09/14(月)">
書き込みビューにスペースと&amp;nbsp;を相互に変換する機能を追加
スレ一覧でツールバー非表示の時にCtrl+fや/で検索バーを表示できるようにした
画像ビューにユーザコマンドメニューを追加
スレビューのコンテキストメニューに「選択範囲のレスをあぼ〜ん」を追加
DAT落ちしたスレを開いた時にダイアログを表示するようにした
タブメニューの移動の項目にアイコンを表示するようにした
スレ一覧でスレを複数指定してからDatの保存が出来るようにした
subject.txtのレス数よりも実際のレス数が多い時スレ一覧にアイコンを表示するようにした
スレ一覧で!を押したときに現在のソートのモードをステータスバーに表示するようにした
更新済タブへ移動のショートカットキーとマウスジェスチャ(デフォルト未設定)を追加
</release>

<release version="2.4.2-090927" date="2009/09/27(日)">
画像ビューが埋め込み表示の時にビューを開くとスレビューのスクロール位置がズレる問題を修正
</release>

<release version="2.5.0-beta091103" date="2009/11/3(火)">
書き込みビューが空のときに対応するスレを閉じたら書き込みビューも閉じるようにした
スレ一覧の since、最終書込の表示形式を表示メニューから変更できるようにした
画像ポップアップ上でショートカットキーを使えるようにした
画像ポップアップ上でマウスジェスチャを使えるようにした
画像ポップアップ上でコンテキストメニューを表示できるようにした
フォントと色の詳細設定をタブで分けた
色の詳細設定に「スレビューの選択範囲の色設定に gtkrc を用いる」を追加
色の詳細設定にabout:configから「ツリービューの背景色設定に gtkrc を用いる」を移動
色の詳細設定で複数行を選択可能にした
about:configに「起動時にお気に入りを自動でチェックする」を追加
HTML化された過去ログの読み込みに対応
コンテキストメニューの表示がキャンセルされるとポップアップが消えなくなるバグを修正
画像ビューでタブスクロールボタンを押すとキーボードフォーカスが外れるバグを修正
スレを閉じるときに無駄なディスクアクセスが生じていた問題を修正
スレ一覧の列幅を調整するときに時々一番上のスレを開くバグを修正
ログ一覧の表示機能を実装
</release>

<release version="2.5.0-beta091123" date="2009/11/23(月)">
更新チェック中に対象スレを手動でロードすると更新チェックが停止する時があるバグを修正
お気に入り追加ダイアログで名前を変更してもお気に入りに反映されないバグを修正
板一覧再読み込みで更新量が多いと固まったようになるバグを修正
画像ローダのメモリキャッシュ機能を実装(デフォルトキャッシュ数 3 )
</release>

<release version="2.5.0-091206" date="2009/12/06(日)">
初回起動時のデフォルトフォント候補に小夏フォントを追加
エラーなどのメッセージがファイルに出力される機能を起動オプションとして追加
</release>

<release version="2.5.5-beta091220" date="2009/12/20(日)">
スレ一覧でスレッド924(お知らせスレ)をアイコン表示するようにした
スレビューでIDの重複数のカウント処理を高速化した
スレビューで描画処理を少しだけ最適化した
スレ一覧の読み込みと表示処理を改良した
HTTP201の画像を開けないバグを修正
about:configに「ビューを閉じても書き込み欄の日本語のON/OFF状態を保つ」を追加
p2のログイン処理の仕様変更に対応 ( submit_member -> submit_userlogin )
キャッシュの画像の読み込みに失敗すると画像表示が乱れるバグを修正
</release>

<release version="2.5.5-rc091225" date="2009/12/25(金)">
about:configに「スレ一覧をロードする前にキャッシュにある一覧を表示する」を追加
about:configに「お知らせスレ(924)のアイコンを表示する」を追加
色の詳細設定でデフォルトと異なる設定の行の背景色を変えるようにした
about:configの「true」「false」を「はい」「いいえ」表記に変更
書き込み履歴のあるスレを削除する時はダイアログで問い合わせるようにした
</release>

<release version="2.5.5-091228" date="2009/12/28(月)">
書き込み履歴のあるスレを削除する時の確認ダイアログを非表示に出来るようにした
</release>

</document>
