<?xml version="1.0" encoding="UTF-8"?>
<?xml-stylesheet type="text/xsl" href="history.xsl"?>
<!DOCTYPE document SYSTEM "document.dtd">

<document header="更新履歴">


<history>
  <year>2015</year>
  <year>2014</year>
  <year>2013</year>
  <year>2012</year>
  <year>2011</year>
  <year>2010</year>
  <year>2009</year>
  <year>2008</year>
  <year>2007</year>
  <year>2006</year>
</history>


</document>
