<?xml version="1.0" encoding="UTF-8"?>
<?xml-stylesheet type="text/xsl" href="main.xsl"?>
<!DOCTYPE document SYSTEM "document.dtd">

<document header="その他">


<group>
  <list type="circle">
    <item><text link="move.xml">板移転について</text></item>
    <item><text link="http://sourceforge.jp/projects/jd4linux/wiki/%E3%83%A6%E3%83%BC%E3%82%B6%E3%83%BC%E3%82%B3%E3%83%9E%E3%83%B3%E3%83%89%E8%A8%AD%E5%AE%9A%E9%9B%86">ユーザーコマンド設定集</text> (wiki)</item>
    <item><text link="skin.xml">テーマについて</text></item>
    <item><text link="environment.xml">動作環境の記入について</text></item>
    <item><text link="sound.xml">効果音の再生について</text></item>
    <item><text link="urlreplace.xml">URL変換について</text></item>
  </list>
</group>


</document>
