<?xml version="1.0" encoding="UTF-8"?>
<?xml-stylesheet type="text/xsl" href="main.xsl"?>
<!DOCTYPE document SYSTEM "document.dtd">

<document header="アスキーアート(AA)の入力について">


<group header="操作方法">
  <sentence>
  書き込みビューでアスキーアート(AA)メニューを表示してAAを入力することが
  できる。
  </sentence>

  <descriptions>
    <item header="Alt+a">AAメニューを表示</item>
    <item header="↑、j, Ctrl+p">選択項目を上に移動</item>
    <item header="↓、k, Ctrl+n, space">選択項目を下に移動</item>
    <item header="Enter">決定</item>
    <item header="Esc">キャンセル</item>
  </descriptions>

  <sentence>
  なお、AAメニューの左側の[]の内部にある文字はキーボードショートカットを
  表していて、キーを押すと対応するAAが入力される(数字→英小文字→英大文字の順にキーが割り当てられる。
  ただし h,i,j,k は除く )。
  </sentence>
</group>


<group header="登録方法">
  <sentence>
  AAはキャッシュディレクトリ(デフォルトでは~/.jd/)にaalist.txtというテキ
  ストファイルを作成して登録する。
  </sentence>

  <sentence>一行AAはそのままaalist.txtの各行に登録する。</sentence>

  <sentence>
  複数行AAはキャッシュディレクトリに「aa」というディレクトリを作成し、そ
  の下に複数行AAを保存したテキストファイル(*.txt)をおき、aalist.txtに
  「*ファイル名」という形式で登録する。なお拡張子(.txt)は省略することが
  出来る。なお先頭のアスタリスクを「**」と2つつなげるとファイル名ではなく
  て文字の「*」一文字に変換される。
  </sentence>

<asciiart caption="aalist.txt 登録例">
ｷﾀ━━━━━━(ﾟ∀ﾟ)━━━━━━ !!
*mona
</asciiart>

<asciiart caption="~/.jd/aa/mona.txtの内容">
　 ∧＿∧
　（　´∀｀）
　（　　　　）
　｜　|　 |
　（＿_)＿）
</asciiart>
</group>


</document>
