<?xml version="1.0" encoding="UTF-8"?>
<?xml-stylesheet type="text/xsl" href="main.xsl"?>
<!DOCTYPE document SYSTEM "document.dtd">

<document header="実況モードについて">


<group header="開始と停止方法">
  <sentence>
  デフォルトでは実況モードは使用出来ないようになっている。実況したい板の
  プロパティを開いて「実況する」をチェックすることで実況可能になる。
  </sentence>

  <sentence>
  実況可能にしたら、ツールメニューから実況サブメニューを選択するか、スレ
  ビュー上でF6キーを押すか、表示設定からスレビューのツールバーに実況ボタ
  ンを表示させてから実況ボタンをクリックすると実況が始まる。再び実況サブ
  メニューを選択するか、F6キーを押すか、実況ボタンをクリックするか、スレ
  ビューの適当な場所をクリックすると停止する。
  </sentence>
</group>


<group header="更新間隔">
  <sentence>
  更新間隔は各板別に板のプロパティで設定する。最低更新間隔は 10 秒で、更
  新が無い場合は間隔が5秒ずつ増えて行く。5回更新が無いときは停止する。
  </sentence>
</group>


<group header="オートスクロール">
  <sentence>
  オートスクロールの速度などは全板共通でメニューの「設定」→「その他」→
  「実況設定」から設定する。スクロールモードには「スクロール速度を実況速
  度に合わせて可変させるモード」「常に一定速度でスクロールさせるモード」
  の二通りある。スクロール速度/実況遅れが設定したしきい値を越えると行単
  位でのスクロールに切り替わる。
  </sentence>
  <sentence>
  マウスオンなどでポップアップを表示している間は、オートスクロールを一時停止する。
  </sentence>
</group>


<group header="書き込みビューについて">
  <sentence>
  書き込みビューが表示されているときは書き込みビューが常にフォーカスされ
  る。書き込みビューを埋め込み表示にして「書き込み後に閉じない」ボタンを
  押して使うと実況向けとなる。
  </sentence>
</group>


<group header="実況終了スレの自動削除">
  <sentence>
  実況状態のまま閉じたスレはJD終了時に自動でログを削除する。削除をキャン
  セルするには実況を停止してからスレを閉じるか、もう一度スレを開く(ただ
  し実況モードにはしない)。なお、スレ一覧でしおりをつけたスレや、スレビ
  ューで任意のレスにひとつでもしおりをつけたスレは削除しない。 
  </sentence>
</group>


</document>
